{
  "$schema": "https://json-schema.org/draft/2020-12/schema",
  "$comment": "No $id on purpose: every Rulebook schema is addressed by its file location (docs/reference/naming.md section 6). Closed on purpose: a work package that needs a new key adds it here in its own pull request.",
  "title": "Rulebook settings",
  "description": ".github/Rulebook-Settings.json of an organization rulebook repository. Not expressible here and checked by C5: slugs unique per array after lowercasing, basedOn resolving to an existing base/<slug>.ruleset.json without a cycle, quarantine values naming stages from the settings. See docs/ARCHITECTURE.md section 8 and docs/reference/naming.md.",
  "$defs": {
    "slug": {
      "description": "A level or stage slug: the lowercased name.",
      "type": "string",
      "pattern": "^[a-z0-9-]+(?![\\s\\S])"
    },
    "name": {
      "description": "A level or stage name. Lowercased it is the slug, so only letters, digits and hyphens: no spaces, no dots.",
      "type": "string",
      "pattern": "^[A-Za-z0-9-]+(?![\\s\\S])"
    },
    "quarantinePolicy": {
      "description": "null (the template ships null on purpose and the scan refuses to run, D14) or the stage slugs that receive new ids.",
      "type": ["array", "null"],
      "uniqueItems": true,
      "items": { "$ref": "#/$defs/slug" }
    },
    "level": {
      "type": "object",
      "required": ["name"],
      "properties": {
        "name": { "$ref": "#/$defs/name" },
        "description": { "type": "string" },
        "basedOn": {
          "description": "The name of the level file this level is a delta on, matched case-insensitively; absent for a root level (D29).",
          "$ref": "#/$defs/name"
        }
      },
      "additionalProperties": false
    },
    "stage": {
      "type": "object",
      "required": ["name"],
      "properties": {
        "name": { "$ref": "#/$defs/name" },
        "description": { "type": "string" }
      },
      "additionalProperties": false
    }
  },
  "type": "object",
  "required": ["templateUrl", "baseUrl", "publish", "quarantine", "levels", "stages"],
  "properties": {
    "$schema": { "type": "string" },
    "templateUrl": {
      "description": "The template the update workflow pulls from, AL-Go style: https://github.com/ALCops/rulebook@main.",
      "type": "string",
      "minLength": 1
    },
    "templateSha": {
      "description": "The template commit installed last, written by the update; empty until the first update.",
      "type": "string",
      "pattern": "^([0-9a-f]{40})?(?![\\s\\S])"
    },
    "baseUrl": {
      "description": "Where rulesets/ is served from: https, a host name with an optional port and no user info, no query, fragment, dot segment, quote, backslash, control character or trailing slash; empty until the organization sets it (the template ships it empty and Publish fails until it is set).",
      "type": "string",
      "pattern": "^(https://[A-Za-z0-9]([A-Za-z0-9-]*[A-Za-z0-9])?(\\.[A-Za-z0-9]([A-Za-z0-9-]*[A-Za-z0-9])?)*(:[0-9]{1,5})?(/(?!\\.\\.?(/|(?![\\s\\S])))[^\\s/?#\"\\\\\\u0000-\\u001F]+)*)?(?![\\s\\S])"
    },
    "publish": {
      "description": "The publish target and its fields. Fields of another target are not forbidden; they are ignored.",
      "type": "object",
      "required": ["target"],
      "properties": {
        "target": { "enum": ["pages", "dist-repo", "azure-blob", "gist"] },
        "repository": { "type": "string", "pattern": "^[A-Za-z0-9_.-]+/[A-Za-z0-9_.-]+(?![\\s\\S])" },
        "branch": { "type": "string", "minLength": 1 },
        "storageAccount": { "type": "string", "minLength": 1 },
        "container": { "type": "string", "minLength": 1 },
        "gistId": { "type": "string", "minLength": 1 }
      },
      "additionalProperties": false,
      "allOf": [
        {
          "if": { "required": ["target"], "properties": { "target": { "const": "dist-repo" } } },
          "then": { "required": ["repository", "branch"] }
        },
        {
          "if": { "required": ["target"], "properties": { "target": { "const": "azure-blob" } } },
          "then": { "required": ["storageAccount", "container"] }
        },
        {
          "if": { "required": ["target"], "properties": { "target": { "const": "gist" } } },
          "then": { "required": ["gistId"] }
        }
      ]
    },
    "twins": {
      "description": "Which side of the twin pairs runs (D23).",
      "enum": ["both", "appsource", "pte"],
      "default": "both"
    },
    "quarantine": {
      "description": "The quarantine policy (D14): both keys are mandatory.",
      "type": "object",
      "required": ["stages", "prereleaseStages"],
      "properties": {
        "stages": { "$ref": "#/$defs/quarantinePolicy" },
        "prereleaseStages": { "$ref": "#/$defs/quarantinePolicy" }
      },
      "additionalProperties": false
    },
    "levels": {
      "description": "The published levels in presentation order (D26).",
      "type": "array",
      "minItems": 1,
      "items": { "$ref": "#/$defs/level" }
    },
    "stages": {
      "description": "The stages in presentation order; default is mandatory (D26).",
      "type": "array",
      "minItems": 1,
      "items": { "$ref": "#/$defs/stage" },
      "contains": {
        "type": "object",
        "required": ["name"],
        "properties": { "name": { "pattern": "^[Dd][Ee][Ff][Aa][Uu][Ll][Tt](?![\\s\\S])" } }
      }
    },
    "ghTokenWorkflowSecretName": {
      "description": "Name of the write token secret the update workflow reads (D44); GitHub App JSON or a personal access token, AL-Go format. A GitHub secret name: letters, digits and underscores, not starting with a digit or with GITHUB_ (any case).",
      "type": "string",
      "pattern": "^(?![Gg][Ii][Tt][Hh][Uu][Bb]_)[A-Za-z_][A-Za-z0-9_]*(?![\\s\\S])",
      "default": "GHTOKENWORKFLOW"
    },
    "commitOptions": {
      "type": "object",
      "properties": {
        "createPullRequest": { "type": "boolean" },
        "pullRequestLabels": { "type": "array", "uniqueItems": true, "items": { "type": "string" } }
      },
      "additionalProperties": false
    },
    "site": {
      "description": "The dashboard site (D31, D35, D36).",
      "type": "object",
      "properties": {
        "enabled": { "type": "boolean" },
        "includeJustifications": { "type": "boolean" },
        "updateMode": { "enum": ["skip", "overwrite"] }
      },
      "additionalProperties": false
    },
    "docs": {
      "description": "The organization documentation in docs/ (D50): updateMode skip keeps a page the organization edited and lists it in the update pull request, overwrite replaces it with the template version. Absent means skip.",
      "type": "object",
      "properties": {
        "updateMode": { "enum": ["skip", "overwrite"] }
      },
      "additionalProperties": false
    },
    "update": {
      "description": "The update workflow (WP07): schedule is a five-field cron expression the update writes into UpdateRulebookSystemFiles.yaml as its schedule trigger, or null for none.",
      "type": "object",
      "properties": {
        "schedule": { "type": ["string", "null"], "pattern": "^\\S+( \\S+){4}(?![\\s\\S])" },
        "check": { "description": "false turns the template update check of the Validate action off; an explicit checkForUpdates input still wins.", "type": "boolean", "default": true }
      },
      "additionalProperties": false
    },
    "scan": {
      "description": "The diagnostic scan (WP08): schedule is a five-field cron expression the update writes into ScanDiagnostics.yaml as its schedule trigger, or null for none. An absent scan key or schedule keeps the schedule the template ships.",
      "type": "object",
      "properties": {
        "schedule": { "type": ["string", "null"], "pattern": "^\\S+( \\S+){4}(?![\\s\\S])" }
      },
      "additionalProperties": false
    },
    "unusedRulebookFiles": {
      "description": "Shipped files the update must not re-add and removes when present (WP07, D29): repository-relative paths with /, such as stages/vnext.json. C9 matches the same paths.",
      "type": "array",
      "uniqueItems": true,
      "items": { "type": "string", "pattern": "^[A-Za-z0-9._-]+(/[A-Za-z0-9._-]+)+(?![\\s\\S])" }
    }
  },
  "additionalProperties": false
}
