{
  "templateUrl": "https://github.com/ALCops/rulebook@main",
  "baseUrl": "https://contoso.github.io/rulebook",
  "publish": { "target": "pages" },
  "quarantine": { "stages": null, "prereleaseStages": null },
  "levels": [ { "name": "Essential" } ],
  "stages": [ { "name": "default" } ],
  "update": { "check": false }
}
