{
  "templateUrl": "https://github.com/ALCops/rulebook@main",
  "baseUrl": "https://contosorulebook.z6.web.core.windows.net",
  "publish": { "target": "azure-blob", "storageAccount": "contosorulebook", "container": "$web" },
  "quarantine": { "stages": null, "prereleaseStages": null },
  "levels": [ { "name": "Essential" } ],
  "stages": [ { "name": "default" } ]
}
